{"$schema":"https://json-schema.org/draft/2020-12/schema","type":"object","additionalProperties":false,"properties":{"planVersion":{"const":5},"specId":{"const":"SPEC-0001"},"proofPurpose":{"const":"phase-5"},"authorizationId":{"const":"phase-5/v1"},"baseCommit":{"const":"a2b4f3e0fc492df9cd63bda32554e382a344cdb6"},"dirtyExpectedPaths":{"type":"array","minItems":22,"maxItems":24,"uniqueItems":true,"items":{"type":"string"}},"cleanExpectedPaths":{"const":[]},"outputRoot":{"const":"output/spec-0001/phase-5"},"operationFamilies":{"const":["guarded-http","runner-environment"]},"registry":{"type":"object","additionalProperties":false,"properties":{"path":{"const":"scripts/fixtures/stick-ai/v1/stick-ai-raw-route-cases.json"},"byteLength":{"type":"integer","minimum":1},"sha256":{"type":"string","pattern":"^sha256:[0-9a-f]{64}$"}},"required":["path","byteLength","sha256"]},"selectedCaseIds":{"type":"array","minItems":1,"uniqueItems":true,"items":{"type":"string"}},"evidence":{"type":"object","additionalProperties":false,"properties":{"routePath":{"const":"/api/ai"},"requestTransport":{"const":"guarded-node-loopback-http-exact-bytes/v1"},"exactRequestBytes":{"const":true},"exactResponseBindings":{"const":true},"legacyDrawingFallthrough":{"const":true},"sanitizedServerLogs":{"const":true},"browserPageOperations":{"const":0},"screenshotClaims":{"const":0},"nonLoopbackAttempts":{"const":0},"cleanupFields":{"const":["anchorRestored","sourceRestored","browserContextsOpen","activeGates","activeIntercepts","openChildProcesses","openPorts","residualPaths","residualProfiles"]}},"required":["routePath","requestTransport","exactRequestBytes","exactResponseBindings","legacyDrawingFallthrough","sanitizedServerLogs","browserPageOperations","screenshotClaims","nonLoopbackAttempts","cleanupFields"]}},"required":["planVersion","specId","proofPurpose","authorizationId","baseCommit","dirtyExpectedPaths","cleanExpectedPaths","outputRoot","operationFamilies","registry","selectedCaseIds","evidence"]}
