{
  "planVersion": 5,
  "specId": "SPEC-0001",
  "proofPurpose": "phase-5",
  "authorizationId": "phase-5/v1",
  "baseCommit": "a2b4f3e0fc492df9cd63bda32554e382a344cdb6",
  "dirtyExpectedPaths": [
    ".env.example",
    "app/api/ai/route.ts",
    "scripts/finalizeSpec0001ProofBundle.ts",
    "scripts/fixtures/spec0001-browser/v2/tester-extension-authorizations.json",
    "scripts/fixtures/spec0001-browser/v5/tester-extension-authorization.schema.json",
    "scripts/fixtures/spec0001-browser/v5/tester-extension-plan.schema.json",
    "scripts/fixtures/spec0001-browser/v5/tester-extension-registry.schema.json",
    "scripts/fixtures/spec0001-browser/v5/tester-extension-result.schema.json",
    "scripts/fixtures/stick-ai/v1/phase-5-browser-proof-plan.json",
    "scripts/fixtures/stick-ai/v1/phase-5-proof-commands.json",
    "scripts/fixtures/stick-ai/v1/stick-ai-availability-cases.json",
    "scripts/fixtures/stick-ai/v1/stick-ai-mock-server-cases.json",
    "scripts/fixtures/stick-ai/v1/stick-ai-raw-route-cases.json",
    "scripts/recordSpec0001ProofBundle.ts",
    "scripts/runSpec0001BrowserProof.ts",
    "scripts/spec0001-browser/browserTesterExtensionContract.ts",
    "scripts/validateSpec0001ProofBundle.ts",
    "scripts/validateStickFigureAiMockRoute.ts",
    "src/lib/ai/stickFigureAiAvailability.ts",
    "src/lib/ai/stickFigureAiMockServer.ts",
    "src/lib/ai/stickFigureAiServerDispatch.ts",
    "src/lib/ai/strictStickJson.ts"
  ],
  "cleanExpectedPaths": [],
  "outputRoot": "output/spec-0001/phase-5",
  "operationFamilies": [
    "guarded-http",
    "runner-environment"
  ],
  "registry": {
    "path": "scripts/fixtures/stick-ai/v1/stick-ai-raw-route-cases.json",
    "byteLength": 128405,
    "sha256": "sha256:2e27f73dd561d19e5b92803cbe06f32156632f8d66a8d9e313d5c4c18bb214e0"
  },
  "selectedCaseIds": [
    "availability-marked-mock",
    "availability-unmarked-rejected",
    "availability-wrong-marker-rejected",
    "valid-marked-mock",
    "header-body-marker-mismatch",
    "body-marker-missing-header",
    "body-marker-wrong-header",
    "unsupported-prompt",
    "unsupported-version",
    "unsupported-capability",
    "exact-16384-byte-request",
    "plus-one-16385-byte-request",
    "multibyte-byte-oversize",
    "captured-invalid-utf8",
    "captured-utf8-bom",
    "captured-malformed-header",
    "marker-before-later-syntax",
    "root-duplicate-marker-first",
    "root-duplicate-marker-last",
    "escape-equivalent-duplicate",
    "nested-duplicate-marker",
    "unrelated-duplicate-before-marker",
    "root-workspace-marker-only",
    "project-context-kind-marker-only",
    "project-context-workspace-marker-only",
    "capability-marker-only",
    "syntax-before-marker",
    "marker-like-prompt-string",
    "marker-free-valid-drawing",
    "marker-free-duplicate-drawing",
    "marker-free-invalid-drawing"
  ],
  "evidence": {
    "routePath": "/api/ai",
    "requestTransport": "guarded-node-loopback-http-exact-bytes/v1",
    "exactRequestBytes": true,
    "exactResponseBindings": true,
    "legacyDrawingFallthrough": true,
    "sanitizedServerLogs": true,
    "browserPageOperations": 0,
    "screenshotClaims": 0,
    "nonLoopbackAttempts": 0,
    "cleanupFields": [
      "anchorRestored",
      "sourceRestored",
      "browserContextsOpen",
      "activeGates",
      "activeIntercepts",
      "openChildProcesses",
      "openPorts",
      "residualPaths",
      "residualProfiles"
    ]
  }
}
